{
 "artifacts": [
  {
   "id": "bx-tail-transfer",
   "path": "bx-tail-transfer.bin",
   "sha256": "ad17c71bb70920fe25520d8a80c8b076774931960589611b568f37801e255887",
   "size": 64
  }
 ],
 "cpu": {
  "architecture": "arm",
  "endian": "little",
  "mode": "arm",
  "model": "cortex-r5f"
 },
 "entry": "0x00001000",
 "exclusions": [
  "Synthetic Cortex-R5F user-mode ARM/little-endian only; no X-M1 behavior or ABI claim",
  "No exceptions, coprocessors, mode switching, PC-loading returns, MMIO, interrupts, DMA, caches, scheduling or hardware timing"
 ],
 "exit": "0x00001080",
 "expected": {
  "events": [],
  "memory": [],
  "registers": {
   "cpsr": "0x00000010",
   "lr": "0x00001080",
   "pc": "0x00001080",
   "r0": "0x00000007",
   "r1": "0x00000012",
   "r10": "0x00000000",
   "r11": "0x00000000",
   "r12": "0x00001030",
   "r2": "0x00000000",
   "r3": "0x00000000",
   "r4": "0x00001080",
   "r5": "0x00000000",
   "r6": "0x00000000",
   "r7": "0x00000000",
   "r8": "0x00000000",
   "r9": "0x00000000",
   "sp": "0x00003020"
  },
  "status": "returned"
 },
 "functions": [
  {
   "address": "0x00001000",
   "size": 32
  },
  {
   "address": "0x00001020",
   "size": 16
  },
  {
   "address": "0x00001030",
   "size": 16
  }
 ],
 "id": "bx-tail-transfer",
 "limits": {
  "instructions": 100,
  "wall_ms": 1000
 },
 "origin": "synthetic",
 "provenance": "PROVENANCE.md: hand-encoded ARM instructions and independent arithmetic",
 "regions": [
  {
   "address": "0x00001000",
   "id": "code",
   "initial": {
    "artifact": "bx-tail-transfer",
    "length": 64,
    "offset": 0
   },
   "permissions": "rx",
   "size": 64
  },
  {
   "address": "0x00001080",
   "id": "exit",
   "initial": {
    "zero": true
   },
   "permissions": "rx",
   "size": 4
  },
  {
   "address": "0x00003000",
   "id": "stack",
   "initial": {
    "zero": true
   },
   "permissions": "rw",
   "size": 32
  }
 ],
 "registers": {
  "cpsr": "0x00000010",
  "lr": "0x00001080",
  "r0": "0x00000000",
  "r1": "0x00000000",
  "r10": "0x00000000",
  "r11": "0x00000000",
  "r12": "0x00000000",
  "r2": "0x00000000",
  "r3": "0x00000000",
  "r4": "0x00000000",
  "r5": "0x00000000",
  "r6": "0x00000000",
  "r7": "0x00000000",
  "r8": "0x00000000",
  "r9": "0x00000000",
  "sp": "0x00003020"
 },
 "schema_version": 1,
 "stubs": []
}
