{
 "artifacts": [
  {
   "id": "register-offset-writeback-subtract",
   "path": "register-offset-writeback-subtract.bin",
   "sha256": "9ca2c5f581b81ae0f5b71841ca28054abb581d243fdaa28e9601478483ef292d",
   "size": 8
  },
  {
   "id": "register-offset-writeback-subtract-data",
   "path": "register-offset-writeback-subtract-data.bin",
   "sha256": "dda0d6a7719e00b1ca45a23d8f7132204ca5ebf3d2247713384a645f337f9425",
   "size": 16
  }
 ],
 "cpu": {
  "architecture": "arm",
  "endian": "little",
  "mode": "arm",
  "model": "cortex-r5f"
 },
 "entry": "0x00001004",
 "exclusions": [
  "Synthetic Cortex-R5F user-mode ARM/little-endian only; no X-M1 behavior or ABI claim",
  "No exceptions, coprocessors, mode switching, PC-loading returns, MMIO, interrupts, DMA, caches, scheduling or hardware timing"
 ],
 "exit": "0x00001080",
 "expected": {
  "events": [],
  "memory": [],
  "registers": {
   "cpsr": "0x00000010",
   "lr": "0x00001080",
   "pc": "0x00001080",
   "r0": "0xfffffffe",
   "r1": "0x00002004",
   "r10": "0x00000000",
   "r11": "0x00000000",
   "r12": "0x00000000",
   "r2": "0xffffffff",
   "r3": "0x00000011",
   "r4": "0x00000000",
   "r5": "0x00000000",
   "r6": "0x00000000",
   "r7": "0x00000000",
   "r8": "0x00000000",
   "r9": "0x00000000",
   "sp": "0x00003020"
  },
  "status": "returned"
 },
 "functions": [
  {
   "address": "0x00001004",
   "size": 8
  }
 ],
 "id": "register-offset-writeback-subtract",
 "limits": {
  "instructions": 100,
  "wall_ms": 1000
 },
 "origin": "synthetic",
 "provenance": "PROVENANCE.md: hand-encoded ARM instructions and independent arithmetic",
 "regions": [
  {
   "address": "0x00001004",
   "id": "code",
   "initial": {
    "artifact": "register-offset-writeback-subtract",
    "length": 8,
    "offset": 0
   },
   "permissions": "rx",
   "size": 8
  },
  {
   "address": "0x00001080",
   "id": "exit",
   "initial": {
    "zero": true
   },
   "permissions": "rx",
   "size": 4
  },
  {
   "address": "0x00002004",
   "id": "data",
   "initial": {
    "artifact": "register-offset-writeback-subtract-data",
    "length": 16,
    "offset": 0
   },
   "permissions": "rw",
   "size": 16
  },
  {
   "address": "0x00003000",
   "id": "stack",
   "initial": {
    "zero": true
   },
   "permissions": "rw",
   "size": 32
  }
 ],
 "registers": {
  "cpsr": "0x00000010",
  "lr": "0x00001080",
  "r0": "0xfffffffe",
  "r1": "0x00002002",
  "r10": "0x00000000",
  "r11": "0x00000000",
  "r12": "0x00000000",
  "r2": "0xffffffff",
  "r3": "0x00000000",
  "r4": "0x00000000",
  "r5": "0x00000000",
  "r6": "0x00000000",
  "r7": "0x00000000",
  "r8": "0x00000000",
  "r9": "0x00000000",
  "sp": "0x00003020"
 },
 "schema_version": 1,
 "stubs": []
}
