{"artifacts":[{"id":"jump-table-outside","path":"jump-table-outside.bin","sha256":"9b9f8e0b17adbd1e973836f7fd4f59c30915036df09d8a8196f810099037cc96","size":28}],"cpu":{"architecture":"arm","endian":"little","mode":"arm","model":"cortex-r5f"},"entry":"0x00001004","exclusions":["Synthetic Cortex-R5F user-mode ARM/little-endian only; no X-M1 behavior or ABI claim","No exceptions, coprocessors, mode switching, PC-loading returns, MMIO, interrupts, DMA, caches, scheduling or hardware timing"],"exit":"0x00001080","expected":{"events":[],"memory":[],"registers":{"cpsr":"0x60000010","lr":"0x00001080","pc":"0x00001040","r0":"0xfffffffe","r1":"0x00000001","r10":"0x00000000","r11":"0x00000000","r12":"0x00000000","r2":"0x00002004","r3":"0x00000000","r4":"0x00000000","r5":"0x00000000","r6":"0x00000000","r7":"0x00000000","r8":"0x00000000","r9":"0x00000000","sp":"0x00003020"},"status":"unknown_call"},"functions":[{"address":"0x00001004","size":28}],"id":"jump-table-outside","limits":{"instructions":100,"wall_ms":1000},"origin":"synthetic","provenance":"PROVENANCE.md: hand-encoded ARM instructions and independent arithmetic","regions":[{"address":"0x00001004","id":"code","initial":{"artifact":"jump-table-outside","length":28,"offset":0},"permissions":"rx","size":64},{"address":"0x00001080","id":"exit","initial":{"zero":true},"permissions":"rx","size":4},{"address":"0x00002004","id":"data","initial":{"zero":true},"permissions":"rw","size":4},{"address":"0x00003000","id":"stack","initial":{"zero":true},"permissions":"rw","size":32}],"registers":{"cpsr":"0x00000010","lr":"0x00001080","r0":"0xfffffffe","r1":"0x00000001","r10":"0x00000000","r11":"0x00000000","r12":"0x00000000","r2":"0x00002004","r3":"0x00000000","r4":"0x00000000","r5":"0x00000000","r6":"0x00000000","r7":"0x00000000","r8":"0x00000000","r9":"0x00000000","sp":"0x00003020"},"schema_version":1,"stubs":[]}
