{"artifacts":[{"id":"sxth","path":"sxth.bin","sha256":"e6ed2f768436aacfa3114df1ec0873a9cb8a48f98683bb78ee768917051824e5","size":12}],"cpu":{"architecture":"arm","endian":"little","mode":"arm","model":"cortex-r5f"},"entry":"0x00001004","exclusions":["Synthetic Cortex-R5F user-mode ARM/little-endian only; no X-M1 behavior or ABI claim","No exceptions, coprocessors, mode switching, PC-loading returns, MMIO, interrupts, DMA, caches, scheduling or hardware timing"],"exit":"0x00001080","expected":{"events":[],"memory":[],"registers":{"cpsr":"0x00000010","lr":"0x00001080","pc":"0x00001080","r0":"0xffff8765","r1":"0x00018765","r10":"0x00000000","r11":"0x00000000","r12":"0x00000000","r2":"0xffffff80","r3":"0x00ff8000","r4":"0x00000000","r5":"0x00000000","r6":"0x00000000","r7":"0x00000000","r8":"0x00000000","r9":"0x00000000","sp":"0x00003020"},"status":"returned"},"functions":[{"address":"0x00001004","size":12}],"id":"sxth","limits":{"instructions":100,"wall_ms":1000},"origin":"synthetic","provenance":"PROVENANCE.md: hand-encoded ARM instructions and independent arithmetic","regions":[{"address":"0x00001004","id":"code","initial":{"artifact":"sxth","length":12,"offset":0},"permissions":"rx","size":12},{"address":"0x00001080","id":"exit","initial":{"zero":true},"permissions":"rx","size":4},{"address":"0x00002004","id":"data","initial":{"zero":true},"permissions":"rw","size":4},{"address":"0x00003000","id":"stack","initial":{"zero":true},"permissions":"rw","size":32}],"registers":{"cpsr":"0x00000010","lr":"0x00001080","r0":"0xfffffffe","r1":"0x00018765","r10":"0x00000000","r11":"0x00000000","r12":"0x00000000","r2":"0x00002004","r3":"0x00ff8000","r4":"0x00000000","r5":"0x00000000","r6":"0x00000000","r7":"0x00000000","r8":"0x00000000","r9":"0x00000000","sp":"0x00003020"},"schema_version":1,"stubs":[]}
