{
  "schema_version": 1,
  "id": "unaligned-read",
  "origin": "synthetic",
  "provenance": "PROVENANCE.md: hand-encoded ARM instructions and independent arithmetic",
  "cpu": {
    "architecture": "arm",
    "model": "cortex-r5f",
    "mode": "arm",
    "endian": "little"
  },
  "artifacts": [
    {
      "id": "unaligned-read",
      "path": "unaligned-read.bin",
      "size": 8,
      "sha256": "1518613726697d224285da610a454c95c3f8a9a7891af1d2dbd3c636f1e455fa"
    }
  ],
  "entry": "0x00001004",
  "exit": "0x00001080",
  "registers": {
    "r0": "0xfffffffe",
    "r1": "0x00000005",
    "r2": "0x00002005",
    "r3": "0x00000000",
    "r4": "0x00000000",
    "r5": "0x00000000",
    "r6": "0x00000000",
    "r7": "0x00000000",
    "r8": "0x00000000",
    "r9": "0x00000000",
    "r10": "0x00000000",
    "r11": "0x00000000",
    "r12": "0x00000000",
    "sp": "0x00003020",
    "lr": "0x00001080",
    "cpsr": "0x00000010"
  },
  "regions": [
    {
      "id": "code",
      "address": "0x00001004",
      "size": 8,
      "permissions": "rx",
      "initial": {
        "artifact": "unaligned-read",
        "offset": 0,
        "length": 8
      }
    },
    {
      "id": "exit",
      "address": "0x00001080",
      "size": 4,
      "permissions": "rx",
      "initial": {
        "zero": true
      }
    },
    {
      "id": "data",
      "address": "0x00002004",
      "size": 8,
      "permissions": "rw",
      "initial": {
        "zero": true
      }
    },
    {
      "id": "stack",
      "address": "0x00003000",
      "size": 32,
      "permissions": "rw",
      "initial": {
        "zero": true
      }
    }
  ],
  "functions": [
    {
      "address": "0x00001004",
      "size": 8
    }
  ],
  "stubs": [],
  "limits": {
    "instructions": 100,
    "wall_ms": 1000
  },
  "expected": {
    "status": "memory_guard",
    "registers": {
      "r0": "0xfffffffe",
      "r1": "0x00000005"
    },
    "memory": [],
    "events": []
  },
  "exclusions": [
    "Synthetic Cortex-R5F user-mode ARM/little-endian only; no X-M1 behavior or ABI claim",
    "No exceptions, coprocessors, mode switching, PC-loading returns, MMIO, interrupts, DMA, caches, scheduling or hardware timing"
  ]
}
