{
 "artifacts": [
  {
   "id": "halfword-postindex",
   "path": "halfword-postindex.bin",
   "sha256": "e2f68141ce016344b8f46ba96d4f4aa9c38055056a00d72910fd14db9f3f9c6e",
   "size": 12
  },
  {
   "id": "halfword-postindex-data",
   "path": "halfword-postindex-data.bin",
   "sha256": "1a072f0d0e3228871b5788dcfc5edaf951fec1ba4a8cc87dda4b1b836fdf5632",
   "size": 4
  }
 ],
 "cpu": {
  "architecture": "arm",
  "endian": "little",
  "mode": "arm",
  "model": "cortex-r5f"
 },
 "entry": "0x00001004",
 "exclusions": [
  "Synthetic Cortex-R5F user-mode ARM/little-endian only; no X-M1 behavior or ABI claim",
  "No exceptions, coprocessors, mode switching, PC-loading returns, MMIO, interrupts, DMA, caches, scheduling or hardware timing"
 ],
 "exit": "0x00001080",
 "expected": {
  "events": [],
  "memory": [
   {
    "hex": "00f07856",
    "offset": 0,
    "region": "data"
   }
  ],
  "registers": {
   "cpsr": "0x00000010",
   "lr": "0x00001080",
   "pc": "0x00001080",
   "r0": "0x12345678",
   "r1": "0x0000f000",
   "r10": "0x00000000",
   "r11": "0x00000000",
   "r12": "0x00000000",
   "r2": "0x00002008",
   "r3": "0x00000000",
   "r4": "0x00000000",
   "r5": "0x00000000",
   "r6": "0x00000000",
   "r7": "0x00000000",
   "r8": "0x00000000",
   "r9": "0x00000000",
   "sp": "0x00003020"
  },
  "status": "returned"
 },
 "functions": [
  {
   "address": "0x00001004",
   "size": 12
  }
 ],
 "id": "halfword-postindex",
 "limits": {
  "instructions": 100,
  "wall_ms": 1000
 },
 "origin": "synthetic",
 "provenance": "PROVENANCE.md: hand-encoded ARM instructions and independent arithmetic",
 "regions": [
  {
   "address": "0x00001004",
   "id": "code",
   "initial": {
    "artifact": "halfword-postindex",
    "length": 12,
    "offset": 0
   },
   "permissions": "rx",
   "size": 12
  },
  {
   "address": "0x00001080",
   "id": "exit",
   "initial": {
    "zero": true
   },
   "permissions": "rx",
   "size": 4
  },
  {
   "address": "0x00002004",
   "id": "data",
   "initial": {
    "artifact": "halfword-postindex-data",
    "length": 4,
    "offset": 0
   },
   "permissions": "rw",
   "size": 4
  },
  {
   "address": "0x00003000",
   "id": "stack",
   "initial": {
    "zero": true
   },
   "permissions": "rw",
   "size": 32
  }
 ],
 "registers": {
  "cpsr": "0x00000010",
  "lr": "0x00001080",
  "r0": "0x12345678",
  "r1": "0xffffffff",
  "r10": "0x00000000",
  "r11": "0x00000000",
  "r12": "0x00000000",
  "r2": "0x00002004",
  "r3": "0x00000000",
  "r4": "0x00000000",
  "r5": "0x00000000",
  "r6": "0x00000000",
  "r7": "0x00000000",
  "r8": "0x00000000",
  "r9": "0x00000000",
  "sp": "0x00003020"
 },
 "schema_version": 1,
 "stubs": []
}
