{"artifacts":[{"id":"ldrsb-preindexed","path":"ldrsb-preindexed.bin","sha256":"62052b32829c31159e84a133e7f8e81d34c4aa0b3ed1dc59b144faa9624ae0ab","size":8},{"id":"ldrsb-preindexed-data","path":"ldrsb-preindexed-data.bin","sha256":"3f4f8d0598e76a99ccb6af56a6f28d2eb3dd1cdcaa479bd907909d2bc9d52cf4","size":4}],"cpu":{"architecture":"arm","endian":"little","mode":"arm","model":"cortex-r5f"},"entry":"0x00001004","exclusions":["Synthetic Cortex-R5F user-mode ARM/little-endian only; no X-M1 behavior or ABI claim","No exceptions, coprocessors, mode switching, PC-loading returns, MMIO, interrupts, DMA, caches, scheduling or hardware timing"],"exit":"0x00001080","expected":{"events":[],"memory":[{"hex":"00008000","offset":0,"region":"data"}],"registers":{"cpsr":"0x00000010","lr":"0x00001080","pc":"0x00001080","r0":"0xfffffffe","r1":"0xffffff80","r10":"0x00000000","r11":"0x00000000","r12":"0x00000000","r2":"0x00002004","r3":"0x00000000","r4":"0x00000000","r5":"0x00000000","r6":"0x00000000","r7":"0x00000000","r8":"0x00000000","r9":"0x00000000","sp":"0x00003020"},"status":"returned"},"functions":[{"address":"0x00001004","size":8}],"id":"ldrsb-preindexed","limits":{"instructions":100,"wall_ms":1000},"origin":"synthetic","provenance":"PROVENANCE.md: hand-encoded ARM instructions and independent arithmetic","regions":[{"address":"0x00001004","id":"code","initial":{"artifact":"ldrsb-preindexed","length":8,"offset":0},"permissions":"rx","size":8},{"address":"0x00001080","id":"exit","initial":{"zero":true},"permissions":"rx","size":4},{"address":"0x00002004","id":"data","initial":{"artifact":"ldrsb-preindexed-data","length":4,"offset":0},"permissions":"rw","size":4},{"address":"0x00003000","id":"stack","initial":{"zero":true},"permissions":"rw","size":32}],"registers":{"cpsr":"0x00000010","lr":"0x00001080","r0":"0xfffffffe","r1":"0x00000005","r10":"0x00000000","r11":"0x00000000","r12":"0x00000000","r2":"0x00002004","r3":"0x00000000","r4":"0x00000000","r5":"0x00000000","r6":"0x00000000","r7":"0x00000000","r8":"0x00000000","r9":"0x00000000","sp":"0x00003020"},"schema_version":1,"stubs":[]}
