{"artifacts":[{"id":"ldrsh-preindexed","path":"ldrsh-preindexed.bin","sha256":"695e4ee46c37cc048524bf926bdf2d6818b650df1780ea447b0ef43754fcd6e1","size":8},{"id":"ldrsh-preindexed-data","path":"ldrsh-preindexed-data.bin","sha256":"8486f153dc8f2027d884625e49c3fbff1b817a4e5e27d25833a6512edcf3f45e","size":4}],"cpu":{"architecture":"arm","endian":"little","mode":"arm","model":"cortex-r5f"},"entry":"0x00001004","exclusions":["Synthetic Cortex-R5F user-mode ARM/little-endian only; no X-M1 behavior or ABI claim","No exceptions, coprocessors, mode switching, PC-loading returns, MMIO, interrupts, DMA, caches, scheduling or hardware timing"],"exit":"0x00001080","expected":{"events":[],"memory":[{"hex":"0000cdab","offset":0,"region":"data"}],"registers":{"cpsr":"0x00000010","lr":"0x00001080","pc":"0x00001080","r0":"0xfffffffe","r1":"0xffffabcd","r10":"0x00000000","r11":"0x00000000","r12":"0x00000000","r2":"0x00002004","r3":"0x00000000","r4":"0x00000000","r5":"0x00000000","r6":"0x00000000","r7":"0x00000000","r8":"0x00000000","r9":"0x00000000","sp":"0x00003020"},"status":"returned"},"functions":[{"address":"0x00001004","size":8}],"id":"ldrsh-preindexed","limits":{"instructions":100,"wall_ms":1000},"origin":"synthetic","provenance":"PROVENANCE.md: hand-encoded ARM instructions and independent arithmetic","regions":[{"address":"0x00001004","id":"code","initial":{"artifact":"ldrsh-preindexed","length":8,"offset":0},"permissions":"rx","size":8},{"address":"0x00001080","id":"exit","initial":{"zero":true},"permissions":"rx","size":4},{"address":"0x00002004","id":"data","initial":{"artifact":"ldrsh-preindexed-data","length":4,"offset":0},"permissions":"rw","size":4},{"address":"0x00003000","id":"stack","initial":{"zero":true},"permissions":"rw","size":32}],"registers":{"cpsr":"0x00000010","lr":"0x00001080","r0":"0xfffffffe","r1":"0x00000005","r10":"0x00000000","r11":"0x00000000","r12":"0x00000000","r2":"0x00002004","r3":"0x00000000","r4":"0x00000000","r5":"0x00000000","r6":"0x00000000","r7":"0x00000000","r8":"0x00000000","r9":"0x00000000","sp":"0x00003020"},"schema_version":1,"stubs":[]}
