{"artifacts":[{"id":"doubleword-subtract-wrap","path":"doubleword-subtract-wrap.bin","sha256":"9624d6b28bca178e70452e897aae860dad94e23b8b1af45829c5d957f33198b1","size":8},{"id":"doubleword-subtract-wrap-data","path":"doubleword-subtract-wrap-data.bin","sha256":"a1e8cc0aee4461b4df82e6a18893bd9caea19ea5a941cf599e32959ae5081f22","size":8}],"cpu":{"architecture":"arm","endian":"little","mode":"arm","model":"cortex-r5f"},"entry":"0x00001004","exclusions":["Synthetic Cortex-R5F user-mode ARM/little-endian only; no X-M1 behavior or ABI claim","No exceptions, coprocessors, mode switching, PC-loading returns, MMIO, interrupts, DMA, caches, scheduling or hardware timing"],"exit":"0x00001080","expected":{"events":[],"memory":[],"registers":{"cpsr":"0x00000010","lr":"0x00001080","pc":"0x00001080","r0":"0xfffffffe","r1":"0x00000005","r10":"0x00000000","r11":"0x00000000","r12":"0x00000000","r2":"0x00000000","r3":"0x00000000","r4":"0x12345678","r5":"0xabcdef01","r6":"0x00000000","r7":"0x00000000","r8":"0x00000000","r9":"0x00000000","sp":"0x00003020"},"status":"returned"},"functions":[{"address":"0x00001004","size":8}],"id":"doubleword-subtract-wrap","limits":{"instructions":100,"wall_ms":1000},"origin":"synthetic","provenance":"PROVENANCE.md: hand-encoded ARM instructions and independent arithmetic","regions":[{"address":"0x00001004","id":"code","initial":{"artifact":"doubleword-subtract-wrap","length":8,"offset":0},"permissions":"rx","size":8},{"address":"0x00001080","id":"exit","initial":{"zero":true},"permissions":"rx","size":4},{"address":"0xfffffff8","id":"data","initial":{"artifact":"doubleword-subtract-wrap-data","length":8,"offset":0},"permissions":"rw","size":8},{"address":"0x00003000","id":"stack","initial":{"zero":true},"permissions":"rw","size":32}],"registers":{"cpsr":"0x00000010","lr":"0x00001080","r0":"0xfffffffe","r1":"0x00000005","r10":"0x00000000","r11":"0x00000000","r12":"0x00000000","r2":"0x00000000","r3":"0x00000000","r4":"0x00000000","r5":"0x00000000","r6":"0x00000000","r7":"0x00000000","r8":"0x00000000","r9":"0x00000000","sp":"0x00003020"},"schema_version":1,"stubs":[]}
