{
  "schema_version": 1,
  "id": "native-call",
  "origin": "synthetic",
  "provenance": "PROVENANCE.md: hand-encoded ARM instructions and independent arithmetic",
  "cpu": {
    "architecture": "arm",
    "model": "cortex-r5f",
    "mode": "arm",
    "endian": "little"
  },
  "artifacts": [
    {
      "id": "native-call",
      "path": "native-call.bin",
      "size": 20,
      "sha256": "631125814cd067a3c7885fccf8064aa9c506ca6fd42e9671970b796042600880"
    },
    {
      "id": "callee",
      "path": "callee.bin",
      "size": 8,
      "sha256": "b07e2e2704ce8c323d159ab2283960209789fd5aa19952e762d59f4c2a38dad3"
    }
  ],
  "entry": "0x00001004",
  "exit": "0x00001080",
  "registers": {
    "r0": "0x00000006",
    "r1": "0x00000009",
    "r2": "0x00002004",
    "r3": "0x00000000",
    "r4": "0x00000000",
    "r5": "0x00000000",
    "r6": "0x00000000",
    "r7": "0x00000000",
    "r8": "0x00000000",
    "r9": "0x00000000",
    "r10": "0x00000000",
    "r11": "0x00000000",
    "r12": "0x00000000",
    "sp": "0x00003020",
    "lr": "0x00001080",
    "cpsr": "0x00000010"
  },
  "regions": [
    {
      "id": "code",
      "address": "0x00001004",
      "size": 20,
      "permissions": "rx",
      "initial": {
        "artifact": "native-call",
        "offset": 0,
        "length": 20
      }
    },
    {
      "id": "exit",
      "address": "0x00001080",
      "size": 4,
      "permissions": "rx",
      "initial": {
        "zero": true
      }
    },
    {
      "id": "data",
      "address": "0x00002004",
      "size": 4,
      "permissions": "rw",
      "initial": {
        "zero": true
      }
    },
    {
      "id": "stack",
      "address": "0x00003000",
      "size": 32,
      "permissions": "rw",
      "initial": {
        "zero": true
      }
    },
    {
      "id": "callee",
      "address": "0x00001040",
      "size": 8,
      "permissions": "rx",
      "initial": {
        "artifact": "callee",
        "offset": 0,
        "length": 8
      }
    }
  ],
  "functions": [
    {
      "address": "0x00001004",
      "size": 20
    },
    {
      "address": "0x00001040",
      "size": 8
    }
  ],
  "stubs": [],
  "limits": {
    "instructions": 100,
    "wall_ms": 1000
  },
  "expected": {
    "status": "returned",
    "registers": {
      "r0": "0x00000011",
      "r1": "0x00000009",
      "r2": "0x00002004",
      "r3": "0x00000000",
      "r4": "0x00001080",
      "r5": "0x00000000",
      "r6": "0x00000000",
      "r7": "0x00000000",
      "r8": "0x00000000",
      "r9": "0x00000000",
      "r10": "0x00000000",
      "r11": "0x00000000",
      "r12": "0x00000000",
      "sp": "0x00003020",
      "lr": "0x00001080",
      "cpsr": "0x00000010",
      "pc": "0x00001080"
    },
    "memory": [],
    "events": []
  },
  "exclusions": [
    "Synthetic Cortex-R5F user-mode ARM/little-endian only; no X-M1 behavior or ABI claim",
    "No exceptions, coprocessors, mode switching, PC-loading returns, MMIO, interrupts, DMA, caches, scheduling or hardware timing"
  ]
}
